amniota,amphibio,AnAge,arthropodtraits,Barton et al. 2013,Benedetti et al. 2015,BIEN,BROT,butterflytraits,carabids,CoastBenthBiogeo,Comte & Olden 2017,Comte & Olden 2018,Coral Species traits,Cueva del Castillo et al. 2011,Dahlke et al 2020,DISPERSE,D3,Edwards et al. 2015,EltonTraits,ESSD,Fishbase,GARD [appendix_1],GARD [appendix_2],GARD [appendix_S2],GARD [feldman_et_al._2015],GARD [geb131247],GARD [lizards],GARD [novosolov_et_al._2017],Gillepsie et al. 2017,GLAD[GlobalAnts],Globtherm,Heinen et al. 2017,heteroptera_raw,Kremer et al. 2014,Landcaster & Humphreys 2020,LEDA,MammalDIET,Marine Species traits,PalmTraits,PanTHERIA,PHYLACINE 1.2,Pigot et al. 2020,Polytraits,Meiri 2019,Slade et al. 2013,Storchova & Horak 2018,Sutherland 2000,TraitBank(fish),TraitBank(vertebrates),TraitBank(ecology lit v5),TraitBank,Trochet et al. 2014,TRY,Vieira et al. 2006,Whitmee & Orme 2013,Pacifici et al. 2014,OPDB,AVONET,BioTIME_BodySize-0.1.1,CONUS_freshwater,Rzanny and Voigt 2012,aphid,Vergnes et al 2012,Lislevand_et_al_2007,AnimalTraits,LepTraits 1.0,TOFF,World Spider Trait Database,Morley et al. 2018,Beerli_etal_ES1,Haarstad et al. 2018,Pincebourde_et_al_2021,Horne_et_al_2017,Neff_et_al_2020,Gossner_et_al_2015,Javois_et_al_2019,ChownGaston2010,Delletal2015
female_maturity_d,"Habitat[fossorial, Terrestrial, Aquatic, Arboreal]",Female maturity (days),Body_Size,feeding habit,Minimal length,diameter at breast height (1.3 m),GrowthForm,Overwintering_stage,body_length,type_of_dispersal,tmax,max_dispersal_distance,Abundance GBR,Males Thorax width,tmin,Maximum body size (cm),fruit_type,volume,"Diet (inv, scavenger, fish, fruit, nectar, seed, plant)",body size,Maximum body length,adult mass (g),brood size,Maximum mass (log10(g)),max length (mm),strategy,maximum body mass,Range size (sq km),Saproxylic,Head width across eyes (mm),tmin,Body.mass,Body_length,cell biovolume,tmax,age_first_flowering,"Diet (inv, scavenger, fish, fruit, nectar, seed, plant)",AMBI ecological group,Climbing,ActivityCycle,Terrestrial,Realm,Age at first reproduction,Latitude centroid (from Roll et al. 2017),ForestAffinity,LengthU_MEAN,median natal dispersal distance,trophic guild,trophic guild,trophic guild,trophic guild,Presence of sexual dimorphism,Bark calcium (Ca) content per bark dry mass,"Habitat_type(lake, wetland, warm sprigs, cold springs, headwater streams, rivers, brackish, temporary lentic, ephemeral lotic) Type of water bodies found in: Lakes",Maximum dispersal distance,generation length,body_colors,Beak.Length_Culmen,TR_BodyLength_mm,"AdultFlyingStrength_abbrev (weak, strong)",Body mass,phenology,"Habitat affinity (1 - specialist open land species and generalist species that are more abundant in open land habitats, 2 - generalist species, 3 - generalist species more abundant in woodland and specialist species of woodlands)",M_mass,body mass,Wingspan,taxonomy ,body size,Ctmax,body_length[mm],Length,length_mm,Voltinism,Body_volume,Body_Size,Female relative abdomen size,Elytronlength,WetBodyMass(mg)
litter_or_clutch_size_n,"Diet[Leaves, Flowers, Seeds, Fruits, Arthro, Vert]",Male maturity (days),Dispersal_ability,,Maximal length,flower color,DispMode,Overwintering_location,antenna_length,range_min    ,,mean_dispersal_distance,Abundance world,Males Head width,tmax,Life cycle duration,dia_type,c_per_cell,Trophic guild,feeding mode,Common length,hatchling / neonate mass (g),log female mass,Insular,length measure,clutch size,mean female mass,Body mass (g),Family,Head length (mm),tmax,Flying,Body_width ,,tmin,branching,trophic level,assexual reproduction,Acaulescent,AdultBodyMass_g,Aerial,TrophicLevel,Body size (max),Longitude centroid (from Roll et al. 2017),Wingspan,WingU_MEAN,maximum natal dispersal distnce,diet,diet,diet,diet,Body mass in males,Bark carbon (C) content per bark dry mass,Study_elevation_min,Mean dispersal distance,,body_colortypes,Beak.Length_Nares,TR_QualitativeBodySize,"Emerge_season_1 (Spring, Summer, Fall, Winter)",trophic level,diet activity,"Dispersal (1 - non aerial dispersal, 2 - aerial dispersal)",M_mass_N,brain mass,Forewing Length,ploidy leve,longevity,Ctmax ARR,FWL[mm],Width,width_mm,Body Size,Body_shape,Dispersal_ability,Diet breadth,Bodylength,
litters_or_clutches_per_y,"Diel[Noct, Diu, Crepu]",Gestation/Incubation (days),Feeding_guild,,Trophic Regime,flower pollination syndrome,FruitType,Voltinism,metafemur_length,range_max,,percentiles_dispersal_distance,Age at maturity,Queens Thorax width,trange,Potential number of reproductive cycles per year,dia_exposure,c_citation,Forest stratum,clerance rates,Fecundity,,log hatchling mass,,mass (g),maximum body mass,hatchling mass,Population density (individuals/ha),Family2,Clypeus length (mm),trange,Diet,Body_height,,,buds_seasonality,,blooming,Erect,AdultForearmLen_mm,Mass.g,TrophicNiche,Complex species,insular endemic,WingShape,WingM_MEAN,,burrow depth,burrow depth,burrow depth,burrow depth,Body mass in females,Bark carbon (C) isotope signature (delta 13C),Study_elevation_max ,,,body_patterns,Beak.Width,TR_Mean_LengthMax,"Emerge_season_2 (Spring, Summer, Fall, Winter)",vertical distribution,vertical distribution,,F_mass,metabolic rate,Phenology,sex,upper thermal tolerence,,thorax_width[mm],Thick,height_mm,Dry Mass (mg),Hind_femur_shape,Feeding_guild,Male wing length,Hindtibialength,
adult_body_mass_g,"Seasonality[Wet-Warm, Wet-cold, Dry_warm, Dry_cold]",Weaning (days),Feeding_mode,,Feeding strategy,fruit type,RespFire,Ant_association,eyewidth_corr,median_depth,,,Axial corallite part,Queens Head width,,Dispersal strategy,dia_hetero,mu_inf_amm,Pelagic (0/1),ingestion rates,Age at maturity,,RI (%),,length-mass relationship,mean female mass,insular endemic,Study area (ha),Flight activity period* (days),Mandible length (mm),,,Thorax_length,,,buds_vertical_dist,,body shape,StemSolitary,1AdultHeadBodyLen_mm,Island.Endemicity,ForagingNiche,Depth zonation (benthos),maximum SVL,TrophicGuild,WingF_MEAN,,burrow diameter,burrow diameter,burrow diameter,burrow diameter,Adult body mass,Bark carbon/nitrogen (C/N) ratio,Max_body_size   Maximal body size of immatures,,,mate_guarding,Beak.Depth,TR_adult_body_mass_g,"Emerge_synch_abbrev (Well, Poorly)",feeding/hunting strategy,number of kingdoms [consumed],,F_mass_N,,Voltinism,development stage,,,,Product,body_tp,,Hind_front_leg_ratio,Feeding_guild_short,Female eye size,Headwidth,
maximum_longevity_y,Body_mass_g,Litter/Clutch size,Feeding_specialization,,DVM behaviour,inflorescence length,SeedlEmerg,Forewing_length,resid_femur,,,,Bleaching event,Workers Thorax width,,Adult life span,dia_app_nutrient,mu_amm,Diel,spawning strategy,Trophic level,,mean annual temperature (ºC),,,Realm,Activity time,iqr mean annual temperature,MTL (days),Hind femur length (mm),,,Thorax_width,,,canopy_height,,body size,StemArmed,AgeatEyeOpening_d,IUCN.Status.1.2,,Depth zonation (pelagic),female SVL,DietBreadth,TailU_MEAN,,habitat,habitat,habitat,habitat,Body mass in juveniles,Bark copper (Cu) content per bark dry mass,Measured_length Measured body length of immatures (mm),,,flight_mode,Tarsus.Length,TR_Mean_SeedMass,"Feed_prim_abbrev (PR - predator, CG - Collector-gatherer, CF - Collector-filterer, HB - Herbivore, SH - Shredder, PA - Parasite)",mouthparts,number of orders  [consumed],,unsexed_mass,,Diapause Stage,,,,,,,,Wing_length_rel,Feeding_mode,Male eye size,Hindfemurlength,
gestation_d,Age_at_maturity_min_y,Litters/Clutches per year,Feeding_tissue,,Spawning strategy,leaf area,Clonality,Wingspan,resid_eye,,,,Calcification rate,Workers Head width,,Female wing length (mm),dia_app_elon,k_amm_m,Body mass,egg size,"Habitat (stream, lakes, caves, estuaries, lagoons, brackish seas, intertidal, oceanic, neritic, coral reefs, sea grass)",,temperature seasonality,,,insular endemic,substrate,iqr precipitation,WMSD (months),Scape length (mm),,,Head_width,,,dispersal_type,,brooding,LeavesArmed,AgeatFirstBirth_d,"Diet (Plant, vertebrate, invertebrate)",,Developmental mechanism,hatchling/neonate SVL,AdultsCanFeed,TailM_MEAN,,migratory status,migratory status,migratory status,migratory status,Snout-to-vent length in males,Bark crystals,Measured_width  Measured body width of immatures (mm),,,territoriality,Wing.Length,TR_Max_Height,"Feed_mode_sec (PR - predator, CG - Collector-gatherer, CF - Collector-filterer, HB - Herbivore, SH - Shredder, PA - Parasite)",exposition,foraging mode,,unsexed_mass_N,,Canopy Afnit,,,,,,,,Leg_length_rel,Feeding_specialization,Female forehead width,Mass,
weaning_d,Age_at_maturity_max_y,Inter-litter/Interbirth interval,Feeding_plant_part,,Pelagic layer,leaf area per leaf dry mass,FruitMass,Hostplant_family,resid_antenna,,,,Chlorophyll a,,,Wing pair type,dia_app_hook,k_amm,,clutch size,"Feeding habit (hunting, fitering plankton, grazing)",,,,,Latitude,diet,iqr seasonality,Seasonality index,Weber's length (mm),,,Eye_width,,,leaf_distribution,,calcification,MaxStemHeight_m,BasalMetRate_mLO2hr,Diet.Vertebrate,,Ecosystem engineering,Leg development,Population trends,TailF_MEAN,,EcomorphologicalGuild,EcomorphologicalGuild,EcomorphologicalGuild,EcomorphologicalGuild,Snout-to-vent length in females,Bark density (bark dry mass per bark volume),Measured_height Measured body height of immatures (mm),,,continents,Kipps.Distance,,"Female_disp_abbrev (high - >1km flight before laying eggs, low - <1 km flight before laying eggs)",parasitism,starvation capability,,M_wing,,Edge Afnit,,,,,,,,Antenna_length_rel,Feeding_tissue,Male forehead width,Winglength,
birth_or_hatching_weight_g,Body_size_mm,Birth weight (g),Endophagous_lifestyle,,,leaf carbon content per leaf dry mass,SeedMass,Hostplant_specificity,,,,,Coloniality,,,Lifelong fecundity (number of eggs per female),dia_app_flat,vmax_amm,,fecundity,Body mass,,,,,activity time,reproduction,iqr altitude,Peak activity,Pronotum width (mm),,,Antenna_Seg1,,,ldmc_geo,,dispersion mode,MaxStemDia_cm,BasalMetRateMass_g,Diet.Invertebrate,,Egg size,mass_equation (Feldman et al. 2016 unless stated),MovementRate,BillU_MEAN,,trophic level,trophic level,trophic level,trophic level,Adult snout-to-vent length,Bark iron (Fe) content per bark dry mass,Body_shape      Body shape,,,aquatic_habitats,Secondary1,,"Habit_prim (Burrower, Clinger, Skater, Swimmer, Sprawler, Climber, Planktonic)",aerial mobility,aerial activity,,M_wing_N,,Moisture Afnity,,,,,,,,Eye_width_rel,Feeding_plant_part,Female antenna length,Thoraxlength,
weaning_weight_g,Size_at_maturity_min_mm,Weaning weight (g),Stratum_use,,,leaf carbon content per leaf nitrogen content,LeafDivision,Hostplant_type,,,,,Colony area,,,Propensity to drift,dia_app_ballo,vmax_amm_c,,myelination,Feeding guild,,,,,substrate,Red List status,iqr NPP,Total abundance,Inter-ocular width (mm),,,Antenna_Seg2,,,leaf_mass,,environmental position,UnderstoreyCanopy,DietBreadth,,,Environmental position,intercept,,BillM_MEAN,,body shape,body shape,body shape,body shape,Total length in males,Bark magnesium (Mg) content per bark dry mass,Mediate_drag    Indication of whether shape mediates drag,,,climates,Hand-Wing.Index,,"Habit_sec (Burrower, Clinger, Skater, Swimmer, Sprawler, Climber, Planktonic)",degree of omnivory,walking activity,,F_wing,,Disturbance Afnity,,,,,,,,Feeding_specialization,Endophagous_lifestyle,Male antenna length,Size,
egg_mass_g,Size_at_maturity_max_mm,Adult weight (g),,,,leaf compoundness,LeafLifespan,Hostplant_growth_form,,,,,Colony bleached,,,,dia_app_muci,qmin_amm,,hibernation,Generation time,,,,,microhabitat,Population trend,iqr solar radiation,Number of traps (presence),Max eye width (mm),,,Antenna_Seg3,,,leaf_size,,feeding type,MaxLeafNumber,DispersalAge_d,,,Epitoky,slope,,BillF_MEAN,,breedingSeason,breedingSeason,breedingSeason,breedingSeason,Total lenght in females,Bark manganese (Mn) content per bark dry mass,"Morphology adaptation (sucker, friction, hooks, silk, ballast, hairy)",,,ecozones,Tail.Length,,"Max_body_size_abbrev (small - <9mm, Medium - 9-16 mm, Large - >16 mm)",degree of specialization,mean density,,F_wing_N,,Host Plants,,,,,,,,Feeding_tissue,Stratum_use,Male antenna type,Forewinglength,
incubation_d,Longevity_max_y,Growth rate (1/days),,,,leaf dry mass,LeafShape,Hostplant_part,,,,,Colony maximum diameter,,,,dia_app_other,qmin_amm_c,,resting eggs,Reproductive guild,,,,,more of reproduction,mean body temperature,Diet (Proxy for Trophic level),Weighted latitude,Whole body length (mm),,,Antenna_Seg4,,,morphology_disperal,,fossil range,Max_Blade_Length_m,GestationLen_d,,,Factors triggering reproduction,Activity time,,TarsusU_MEAN,,stageAtFertilization,stageAtFertilization,stageAtFertilization,stageAtFertilization,Adult total length,Bark nitrogen (N) content per bark dry mass,Armor   Degree of body armoring,,,habitat_openness,Mass,,"Resp_abbrev (Tegument, Gills, Plastron_spiracle)",,,,Unsexed_wing,,Oviposition Style,,,,,,,,Hibernation,Stratum_use_short,,Headlength,
fledging_age_d,Litter_size_min_n,Maximum longevity (yrs),,,,leaf dry mass per leaf fresh mass,LNCm,Hostplant_age,,,,,Colony part,,,,dia_app_no,qmax_amm,,respiration rates,,,,,,NPP,activity period,Biogeographical realm,Weighted longitude,Sculpturing,,,Antenna_Seg5,,,growth_form,,functional group,Max_Rachis_Length_m,HabitatBreadth,,,Fecundity,Activity time: comments,,TarsusM_MEAN,,rateOfDevelopment,rateOfDevelopment,rateOfDevelopment,rateOfDevelopment,Head length < Body length,Bark nitrogen (N) isotope signature (delta 15N),Resp_early      Respiration mode of early instars,,,sex_polymorphisms,Habitat,,"Rheophily_abbrev (Depo, Depo_eros, Eros)",,,,Unsexed_wing_N,,,,,,,,,,Generations,,,Length,
longevity_y,Litter_size_max_n,IMR (per yr),,,,leaf fresh mass,SLA,Larval_environment,,,,,Colony shape factor,,,,dia_morph,qmax_amm_c,,growth rates,,,,,,temperature,latitudinal centroid,Range size within biogeographical realm (sq km),Standard deviation of weighted latitude,Pilosity (#),,,Front.Tibia_length,,,life_span,,gamete type,Max_Petiole_length_m,HomeRange_km2,,,Feeding structure,substrate,,TarsusF_MEAN,,SkeletalReinforcement,SkeletalReinforcement,SkeletalReinforcement,SkeletalReinforcement,Head length = Body length,"Bark persistence (deciduous, persistent)",Resp_late       Respiration mode of late instars,,,sex_dimorphisms,Migration,,"Thermal_pref (Cold stenothermal (<5 C), Cold-cool eurythermal (0-15 C), Cool-warm eurythermal (5-30 C), Warm eurythermal (15-30 C), Hot euthermal (>30 C))",,,,M_tarsus_N,,,,,,,,,,Moisture_pref_mean,,,Forewing length,
male_maturity_d,Reproductive_output_y,MRDT (yrs),,,,leaf lamina fracture toughness,StemDensity,Hostplant_patch_size,,,,,Colony surface area,,,,dia_mass,mu_inf_nit,,development duration,,,,,,annual precipitation,mean seasonal temperature,,Standard deviation of  weighted longitude,Number of Spines (#),,,Mid.Tibia_length ,,,releasing_height,,gametophyte arrangement,AverageFruitLength_cm,HomeRange_Indiv_km2,,,Feeding type,substrate: comments,,WeightU_MEAN,,InterBirthInterval,InterBirthInterval,InterBirthInterval,InterBirthInterval,Head length > Body length,Bark phosphorus (P) content per bark dry mass,Resp_adult      Respiration mode of aquatic adults,,,geo_polymorphisms,Trophic.Level,,"Voltinism_abbrev (Semivoltine - less than one generation per year, Univoltine - One generation per year, Bi_multivoltine - more than one generation per year)",,,,F_tarsus,,,,,,,,,,Moisture_pref_range,,,Wingcellsize,
inter_litter_or_interbirth_interval_y,Offspring_size_min_mm,Metabolic rate (W),,,,leaf life span,NutritionalRelat,Egg_laying_type,,,,,Corallite width,,,,dia_surfacestructure,mu_nit,,,,,,,,precipitation seasonality,mean annual temeprature,,Mean body size (mm),Dominant colour head (Fig. 16),,,Hind.Tibia_length,,,seed_longevity,,larval development,MinFruitLength_cm,InterbirthInterval_d,,,Fertilization type,diet,,WeightM_MEAN,,LittersPerYear,LittersPerYear,LittersPerYear,LittersPerYear,Foot length in males,Bark potassium (K) content per bark dry mass,"Emergence behavior (Drifting, climbing, crawling)",,,body_lengths,Trophic.Niche,,,,,,F_tarsus_N,,,,,,,,,,,,,Totallength,
female_body_mass_g,Offspring_size_max_mm,Body mass (g),,,,leaf nitrogen content per leaf area,LeafPhenology,Egg_laying_location,,,,,Corallite width maximum,,,,dia_length,k_nit_m,,,,,,,,temperature seasonality,,,Minimum body size (mm),Dominant colour mesosoma (Fig. 16),,,Front.Femur_length,,,seed_mass,,life cycle,MaxFruitLength_cm,LitterSize,,,Habitat type,diet: comments,,WeightF_MEAN,,CaudalFinShape,CaudalFinShape,CaudalFinShape,CaudalFinShape,Foot length in females,Bark sclereids arrangement,Emerge_season_all_year  Indicates whether emergence can occur all year,,,forewing_lengths,Primary.Lifestyle,,,,,,Unsexed_tarsus,,,,,,,,,,,,,Pronotumlength,
male_body_mass_g,"Breeding strategy[Dir, Lav, Viv]",Temperature (K),,,,leaf nitrogen content per leaf dry mass,Height,Egg_lay_light_environment,,,,,Corallite width minimum,,,,dia_width,k_nit,,,,,,,,,,,Maximum body size (mm),Dominant colour gaster (Fig. 16),,,Hind.Femur_length,,,seed_number,,life span,AverageFruitWidth_cm,LittersPerYear,,,Habitat type of settlement/ early  development,foraging mode,,Sexual,,EggMass,EggMass,EggMass,EggMass,Adult foot length,"Bark secondary compounds: oil, tannins, latex, slime",Emerge_synch    Indicates whether emergence is synchronous,,,hindwing_lengths,Min.Latitude,,,,,,Unsexed_tarsus_N,,,,,,,,,,,,,Elytronlength/width,
no_sex_body_mass_g,,,,,,leaf phosphorus content per leaf area,Lifespan,Flight_months,,,,,Damage,,,,dia_height,vmax_nit,,,,,,,,,,,,Polymorphism,,,Front.Femur_width,,,seed_shape,,mobility,MinFruitWidth_cm,MaxLongevity_m,,,Intra- and interspecific competition,foraging mode (comments),,dimorphism,,PrimaryDiet,PrimaryDiet,PrimaryDiet,PrimaryDiet,Hind limb length in males,Bark sieve tubes grouping,Emerge_season_1 Season that emergence begins,,,has_wing_pigment,Max.Latitude,,,,,,M_bill,,,,,,,,,,,,,Wingarea,
egg_width_mm,,,,,,leaf phosphorus content per leaf dry mass,Diaspore,Adult_feeding,,,,,Dark respiration,,,,dia_shape,vmax_nit_c,,,,,,,,,,,,Queen number,,,Hind.Femur_width,,,shoot_growth_form,,plant habit,MaxFruitWidth_cm,NeonateBodyMass_g,,,Juvenile mobility,reproductive mode,,Clutch_MIN,,Parental_investment,Parental_investment,Parental_investment,Parental_investment,Hind limb length in females,Bark structure ,Emerge_season_2 Season that emergence ends,,,wing_pigment_extent_discrete,Centroid.Latitude,,,,,,M_bill_N,,,,,,,,,,,,,Wing:thoraxsizeratio,
egg_length_mm,,,,,,leaf photosynthetic rate per leaf area,BudSource,Adult_roosting,,,,,Depth lower,,,,dia_form,qmin_nit,,,,,,,,,,,,Worker number (#),,,Rostrum_length,,,snp,,reproductive frequency,FruitSizeCategorical,NeonateHeadBodyLen_mm,,,Larval development,clutch size,,Clutch_MAX,,ForagingTime,ForagingTime,ForagingTime,ForagingTime,Adult hind limb length,Bark sulfur (S) content per bark dry mass,Ovipos_behav_prim       Primary oviposition behavior,,,wing_pigment_extent_continuous,Centroid.Longitude,,,,,,F_bill,,,,,,,,,,,,,Wingwidth,
fledging_mass_g,,,,,,leaf photosynthetic rate per leaf dry mass,SoilSeedBank,Mate_locating_type,,,,,Depth transplanted from,,,,vterm,qmin_nit_c,,,,,,,,,,,,Colony type,,,Rostrum_width,,,ssd,,seasonality,FruitShape,PopulationDensity_n/km2,,,Larval feeding type,smallest clutch,,Clutch_MEAN,,DevelopmentalMode,DevelopmentalMode,DevelopmentalMode,DevelopmentalMode,Tibia length in males,"Bark surface structure, texture, age",Ovipos_behav_sec        Secondary oviposition behavior,,,wing_pigment_pattern,Range.Size,,,,,,F_bill_N,,,,,,,,,,,,,Bodymass,
adult_svl_cm,,,,,,leaf relative growth rate,LeafArea,Mate_locating_location,,,,,Depth upper,,,,rank_ane,qmax_nit,,,,,,,,,,,,Colony founding,,,Wing_length,,,tv,,sociability,FruitColorDescription,PopulationGrpSize,,,Larval mode of development,largest clutch,,Broods per year,,ForagingHabitat,ForagingHabitat,ForagingHabitat,ForagingHabitat,Tibia length in females,Bark thickness,Eggs_cement     Indicates whether eggs are cemented,,,wing_pigment_symmetry,,,,,,,Unsexed_bill,,,,,,,,,,,,,Femurlength,
male_svl_cm,,,,,,leaf stomatal conductance for H2O per leaf area,Spinescence,Basking_type,,,,,Direction,,,,rank_hydro,qmax_nit_c,,,,,,,,,,,,Nest Site,,,Wing_width,,,clonal_growth_organs,,spawning,MainFruitColors,SexualMaturityAge_d,,,Lifespan,smallest mean clutch size,,EggL_MEAN,,NestType,NestType,NestType,NestType,Adult tibia length,Bark thickness (inner bark),Ovipos_duration Duration of oviposition period,,,wing_pigment_dimorphism,,,,,,,Unsexed_bill_N,,,,,,,,,,,,,Colonysize,
female_svl_cm,,,,,,leaf stomatal conductance per leaf area,SeedShape,Basking_site,,,,,Dissolved oxygen concentration,,,,rank_epi_wool,mu_inf_p,,,,,,,,,,,,Activity,,,,,,,,species importance to society,Conspicuousness,SocialGrpSize,,,Location of parental care,largest mean clutch size,,EggW_MEAN,,BillLength,BillLength,BillLength,BillLength,Fore limb length < Hind limb length,Bark thickness (outer bark),Feed_mode_prim  Primary feeding mode based on mouthpart morphology,,,wing_pigment_color,,,,,,,M_tail,,,,,,,,,,,,,Wingspan,
birth_or_hatching_svl_cm,,,,,,leaf thickness,RespClip,,,,,,Distance from crest,,,,diaspore_seeds_class,mu_p,,,,,,,,,,,,Diet,,,,,,,,thallus vertical space used,,TeatNumber,,,Metamorphosis type,breeding age (months),,Egg_MASS,,RangeMidpointLatitude,RangeMidpointLatitude,RangeMidpointLatitude,RangeMidpointLatitude,Fore limb length = Hind limb length,Bark thickness per stem diameter,Feed_mode_sec   Secondary feeding mode based on mouthpart morphology,,,wing_pigment_placement,,,,,,,M_tail_N,,,,,,,,,,,,,,
female_svl_at_maturity_cm,,,,,,longest whole plant longevity,MatResp,,,,,,Distance from shore,,,,,k_p_m,,,,,,,,,,,,Notes,,,,,,,,tolerance to pollutants,,Terrestriality,,,Migrations of adult,youngest age at first breeding (months),,Young Association during nesting,,VocalizationBehavior,VocalizationBehavior,VocalizationBehavior,VocalizationBehavior,Fore limb length > Hind limb length,Bark zinc (Zn) content per bark dry mass,Feed_mode_comments      Food materials consumed,,,wing_pigment_color_type,,,,,,,F_tail,,,,,,,,,,,,,,
female_body_mass_at_maturity_g,,,,,,maximum fruit length,RootDepth,,,,,,Distance from tip,,,,,k_p,,,,,,,,,,,,Political Region1,,,,,,,,unicellularity,,TrophicLevel,,,Mobility of adult,oldest age at first breeding (months),,Nest type,,body size,body size,body size,body size,Presence of discs,Belowground plant organ acid hydrolyzable extractives per belowground plant organ dry mass,Habit_prim      Primary habit,,,female_has_wing_pigment,,,,,,,F_tail_N,,,,,,,,,,,,,,
no_sex_svl_cm,,,,,,maximum leaf length,LDMC,,,,,,Downward flux of suspended particulate matter,,,,,vmax_p,,,,,,,,,,,,Continent,,,,,,,,VME indicative taxon,,WeaningAge_d,,,Mode of reproduction,mean body temperature of active animals in the wild,,Nest building,,,,,,Presence of webbing,Belowground plant organ annual loss of nitrogen (N) through belowground plant organ mortality as a f,Habit_sec       Secondary habit,,,female_wing_pigment_extent_discrete,,,,,,,Unsexed_tail,,,,,,,,,,,,,,
no_sex_maturity_d,,,,,,maximum leaf width,ChemCues,,,,,,Eastern-most range edge,,,,,vmax_p_c,,,,,,,,,,,,,,,,,,,,wave exposure,,WeaningBodyMass_g,,,Parental care/ Brood protection,minimum mean Tb,,Mating system,,,,,,Webbing on toes only,Belowground plant organ annual loss of nitrogen (N) through belowground plant organ mortality as a f,Habit_comments  Habit: Text notes,,,female_wing_pigment_extent_continuous,,,,,,,Unsexed_tail_N,,,,,,,,,,,,,,
,,,,,,maximum whole plant height,OtherCues,,,,,,Eggs per area,,,,,qmin_p,,,,,,,,,,,,,,,,,,,,zonation,,WeaningHeadBodyLen_mm,,,Pattern of oogenesis,maximum mean Tb,,Incubation period,,,,,,Webbing on fingers and toes,Belowground plant organ calcium (Ca) content per belowground plant organ dry mass,"Current_quiet   Current preference (Quiet, Slow, Fast laminar, fast turbulent)",,,female_wing_pigment_placement,,,,,,,Clutch_size,,,,,,,,,,,,,,
,,,,,,maximum whole plant longevity,P50,,,,,,Fish association controlled,,,,,qmin_p_c,,,,,,,,,,,,,,,,,,,,,,References,,,Physiographic feature,Family,,Incubation sex,,,,,,Reduction on fingers only,Belowground plant organ carbon (C) content per belowground plant organ dry mass,"Microhabitat substrate preference (Sand, Silt, Gravel, Rocks, Boulder, LWD, Detritus, Macrophytes)",,,female_body_lengths,,,,,,,Egg_mass,,,,,,,,,,,,,,
,,,,,,minimum fruit length,HeatStimGerm,,,,,,Fish predation controlled,,,,,qmax_p,,,,,,,,,,,,,,,,,,,,,,AdultBodyMass_g_EXT,,,Population sex ratio,Phylogeny,,Hatching,,,,,,Reduction on fingers and toes,Belowground plant organ carbon/nitrogen (C/N) ratio,"Lateral habitat position in water column (Margin, Pools, Riffles, Hyporheic)",,,female_hindwing_lengths,,,,,,,Mating_System,,,,,,,,,,,,,,
,,,,,,minimum leaf length,FireStimFlower,,,,,,Flow rate,,,,,qmax_p_c,,,,,,,,,,,,,,,,,,,,,,LittersPerYear_EXT,,,Predated by,phylogenetic data,,Eggshells,,,,,,Presence of metatarsal tubercle,Belowground plant organ cellulose and hemicellulose content per belowground plant organ dry mass,"Vertical habitat position in water column (Surface, Pelagic, Benthis, Hyporheic)",,,female_forewing_lengths,,,,,,,,,,,,,,,,,,,,,
,,,,,,minimum leaf width,BarkThick,,,,,,Generation time,,,,,,,,,,,,,,,,,,,,,,,,,,,NeonateBodyMass_g_EXT,,,Reproduction strategy of the individual,IUCN redlist assessment,,Nestling period,,,,,,Dorsoseparation,Belowground plant organ cellulose content per belowground plant organ dry mass,Drift_early     Drift propensity of early instars,,,,,,,,,,,,,,,,,,,,,,,,
,,,,,,minimum whole plant height,CFFuel,,,,,,Genus fossil age,,,,,,,,,,,,,,,,,,,,,,,,,,,WeaningBodyMass_g_EXT,,,Reproduction temperature,IUCN population trend,,Fledging period,,,,,,Webbing colour contrast,Belowground plant organ construction cost per belowground plant organ dry mass,Drift_late      Drift propensity of late instars,,,,,,,,,,,,,,,,,,,,,,,,
